{"prospective_inventory_sha256":"044118685a4489590906848825e4255683c606562e8f9972b9a29fc4405da3fa","request":{"basis":{"inventory_sha256":"db7283fc61598b82d01093b19fb16a5de0585803d9198a0b0949c049bf9aa57e","operation_head_sha256":"e231c82eb77fe59aec76883dc533d92382be1680c5cfa4f398c5429cae142f91"},"batch_id":"mixed-publication","kind":"knowledge","operation_id":"mixed-publication","payloads":[{"content_file":"source-publication/content/a397a4e44d37828f44d93e07999fa70e2bc62e22f46bd9235fae20b5bdc7b34b","path":".raw/derived/markdown-source/3cf31029bd058478d91b8e8942e762a40efab85a08cfd2f66b406ad739525ff2/a397a4e44d37828f44d93e07999fa70e2bc62e22f46bd9235fae20b5bdc7b34b.json","sha256":"a397a4e44d37828f44d93e07999fa70e2bc62e22f46bd9235fae20b5bdc7b34b","size_bytes":737},{"content_file":"source-publication/content/7e468ee53f5803f5432e12d2df36083c8195cf327d5f851a526b1f005336d78f","path":"wiki/concepts/backbone-dit.md","sha256":"7e468ee53f5803f5432e12d2df36083c8195cf327d5f851a526b1f005336d78f","size_bytes":519},{"content_file":"source-publication/content/e5ab67a0b540a69b544ea7e7dc3aac294d61adb67cc7da85e05ba8218dddee92","path":"wiki/meta/ledgers/claim-ledger.json","sha256":"e5ab67a0b540a69b544ea7e7dc3aac294d61adb67cc7da85e05ba8218dddee92","size_bytes":4026},{"content_file":"source-publication/content/21cca27aad2e6dfd2c99f93c524c45a092903495e07274ac10ca998e51a75ec5","path":"wiki/meta/ledgers/source-ledger.json","sha256":"21cca27aad2e6dfd2c99f93c524c45a092903495e07274ac10ca998e51a75ec5","size_bytes":2506},{"content_file":"source-publication/content/fadc6011a93bbdada418d18c15da1d2edb54169a01d3ec30544582b93ee61e9a","path":"wiki/meta/records/assessment-heads.json","sha256":"fadc6011a93bbdada418d18c15da1d2edb54169a01d3ec30544582b93ee61e9a","size_bytes":778},{"content_file":"source-publication/content/5b79a95f98d4c9626d54dd6b35ab827d147bdf666e9043f303fb01e8917ce0c1","path":"wiki/meta/records/papers/sha256-aaaaaaaaaaaaaaaaaaaaaaaaaaaaaaaaaaaaaaaaaaaaaaaaaaaaaaaaaaaaaaaa.json","sha256":"5b79a95f98d4c9626d54dd6b35ab827d147bdf666e9043f303fb01e8917ce0c1","size_bytes":800},{"content_file":"source-publication/content/4669ffb2c99608131d3401f3f4d1862ff6b1a364c2f7282ef576363dc7c47ebe","path":"wiki/meta/records/source-display-heads.json","sha256":"4669ffb2c99608131d3401f3f4d1862ff6b1a364c2f7282ef576363dc7c47ebe","size_bytes":64},{"content_file":"source-publication/content/d4b3e93884d1cf77bb76ef4684f3a0bab7c7d1cef1ff011bafcb4f48626446ae","path":"wiki/meta/records/source-versions/sva-21f13690dbea47cb9cd0c6fd43410abac0d4028e1b4175847851885f2011c109.json","sha256":"d4b3e93884d1cf77bb76ef4684f3a0bab7c7d1cef1ff011bafcb4f48626446ae","size_bytes":1921},{"content_file":"source-publication/content/ecbb9deee6565569f06fb8ca8b719416305ed1e8d8a3cb59ec5b49cde98ae17a","path":"wiki/meta/reviews/clm-e6d6331f11e9b78f11ee/ase-9b0d59411070dabf301e.json","sha256":"ecbb9deee6565569f06fb8ca8b719416305ed1e8d8a3cb59ec5b49cde98ae17a","size_bytes":612},{"content_file":"source-publication/content/c6b26f1476cea1886a32f8a33ec565d7c077ecae377e0cd054e81fee0384ecb7","path":"wiki/papers/sha256-aaaaaaaaaaaaaaaaaaaaaaaaaaaaaaaaaaaaaaaaaaaaaaaaaaaaaaaaaaaaaaaa.md","sha256":"c6b26f1476cea1886a32f8a33ec565d7c077ecae377e0cd054e81fee0384ecb7","size_bytes":1893}],"prospective_inventory_sha256":"044118685a4489590906848825e4255683c606562e8f9972b9a29fc4405da3fa","registration":null,"schema":"video-paper-wiki.source-publication-request.v1"},"request_sha256":"b400921c1d5f2554fee873d3441ebd879c44293332951d047f6c686f093b132f","schema":"video-paper-wiki.source-publication-authority.v1","transaction":{"address_requests":[],"claimed_inputs":[],"declaration_sha256":"b6a3ae4aff1f4f57140925573bcd53a616a61c515e1c48ef29d6351e684ff193","engine_expanded_paths":[],"expected_hashes":{".raw/derived/markdown-source/3cf31029bd058478d91b8e8942e762a40efab85a08cfd2f66b406ad739525ff2/a397a4e44d37828f44d93e07999fa70e2bc62e22f46bd9235fae20b5bdc7b34b.json":null,"wiki/concepts/backbone-dit.md":"ee8e443b636882e88e6cc2d37931dac0670eebc3999dc954ef4c00b51594d530","wiki/meta/ledgers/claim-ledger.json":"48979059d8a489276e1fdbb342485fa47d46cfb864ae55050d86a71431bd0260","wiki/meta/ledgers/source-ledger.json":"a11544f35b51774a4b655d4b014d81a27dcf6597c7f51b7b3612a0bd7db32190","wiki/meta/operations/000000000004-mixed-publication.json":null,"wiki/meta/records/assessment-heads.json":null,"wiki/meta/records/papers/sha256-aaaaaaaaaaaaaaaaaaaaaaaaaaaaaaaaaaaaaaaaaaaaaaaaaaaaaaaaaaaaaaaa.json":null,"wiki/meta/records/source-display-heads.json":null,"wiki/meta/records/source-versions/sva-21f13690dbea47cb9cd0c6fd43410abac0d4028e1b4175847851885f2011c109.json":null,"wiki/meta/registries/operation-head.json":"e231c82eb77fe59aec76883dc533d92382be1680c5cfa4f398c5429cae142f91","wiki/meta/reviews/clm-e6d6331f11e9b78f11ee/ase-9b0d59411070dabf301e.json":null,"wiki/papers/sha256-aaaaaaaaaaaaaaaaaaaaaaaaaaaaaaaaaaaaaaaaaaaaaaaaaaaaaaaaaaaaaaaa.md":null},"head":{"receipt_path":"wiki/meta/operations/000000000004-mixed-publication.json","receipt_sha256":"b51bcf3e5dbb6eac7490f9df89c3e6e8c24a6403f8adfc7405dcb75a0187a55d","schema":"video-paper-wiki.operation-head.v1","sequence":4},"input_bundle_sha256":"f137ecce60901b1199005e9721fb33c44fff0c05199172ee727acee527cc0689","inspection":{"approval_sha256":"52af8ae4d363bc2f1fe70d7bf4e72b9f2d77031245e91c6c00af6576fef81277","changed_paths":[".raw/derived/markdown-source/3cf31029bd058478d91b8e8942e762a40efab85a08cfd2f66b406ad739525ff2/a397a4e44d37828f44d93e07999fa70e2bc62e22f46bd9235fae20b5bdc7b34b.json","wiki/concepts/backbone-dit.md","wiki/meta/ledgers/claim-ledger.json","wiki/meta/ledgers/source-ledger.json","wiki/meta/records/assessment-heads.json","wiki/meta/records/papers/sha256-aaaaaaaaaaaaaaaaaaaaaaaaaaaaaaaaaaaaaaaaaaaaaaaaaaaaaaaaaaaaaaaa.json","wiki/meta/records/source-display-heads.json","wiki/meta/records/source-versions/sva-21f13690dbea47cb9cd0c6fd43410abac0d4028e1b4175847851885f2011c109.json","wiki/meta/reviews/clm-e6d6331f11e9b78f11ee/ase-9b0d59411070dabf301e.json","wiki/papers/sha256-aaaaaaaaaaaaaaaaaaaaaaaaaaaaaaaaaaaaaaaaaaaaaaaaaaaaaaaaaaaaaaaa.md","wiki/meta/operations/000000000004-mixed-publication.json","wiki/meta/registries/operation-head.json"],"expanded_bundle_sha256":"f137ecce60901b1199005e9721fb33c44fff0c05199172ee727acee527cc0689","hashes":{".raw/derived/markdown-source/3cf31029bd058478d91b8e8942e762a40efab85a08cfd2f66b406ad739525ff2/a397a4e44d37828f44d93e07999fa70e2bc62e22f46bd9235fae20b5bdc7b34b.json":"a397a4e44d37828f44d93e07999fa70e2bc62e22f46bd9235fae20b5bdc7b34b","wiki/concepts/backbone-dit.md":"7e468ee53f5803f5432e12d2df36083c8195cf327d5f851a526b1f005336d78f","wiki/meta/ledgers/claim-ledger.json":"e5ab67a0b540a69b544ea7e7dc3aac294d61adb67cc7da85e05ba8218dddee92","wiki/meta/ledgers/source-ledger.json":"21cca27aad2e6dfd2c99f93c524c45a092903495e07274ac10ca998e51a75ec5","wiki/meta/operations/000000000004-mixed-publication.json":"b51bcf3e5dbb6eac7490f9df89c3e6e8c24a6403f8adfc7405dcb75a0187a55d","wiki/meta/records/assessment-heads.json":"fadc6011a93bbdada418d18c15da1d2edb54169a01d3ec30544582b93ee61e9a","wiki/meta/records/papers/sha256-aaaaaaaaaaaaaaaaaaaaaaaaaaaaaaaaaaaaaaaaaaaaaaaaaaaaaaaaaaaaaaaa.json":"5b79a95f98d4c9626d54dd6b35ab827d147bdf666e9043f303fb01e8917ce0c1","wiki/meta/records/source-display-heads.json":"4669ffb2c99608131d3401f3f4d1862ff6b1a364c2f7282ef576363dc7c47ebe","wiki/meta/records/source-versions/sva-21f13690dbea47cb9cd0c6fd43410abac0d4028e1b4175847851885f2011c109.json":"d4b3e93884d1cf77bb76ef4684f3a0bab7c7d1cef1ff011bafcb4f48626446ae","wiki/meta/registries/operation-head.json":"43dd52e38bdf4f3acff72cc6ad0aa342e14faabe7fc4d0e2336b14de94a75015","wiki/meta/reviews/clm-e6d6331f11e9b78f11ee/ase-9b0d59411070dabf301e.json":"ecbb9deee6565569f06fb8ca8b719416305ed1e8d8a3cb59ec5b49cde98ae17a","wiki/papers/sha256-aaaaaaaaaaaaaaaaaaaaaaaaaaaaaaaaaaaaaaaaaaaaaaaaaaaaaaaaaaaaaaaa.md":"c6b26f1476cea1886a32f8a33ec565d7c077ecae377e0cd054e81fee0384ecb7"},"input_bundle_sha256":"f137ecce60901b1199005e9721fb33c44fff0c05199172ee727acee527cc0689","modes":{".raw/derived/markdown-source/3cf31029bd058478d91b8e8942e762a40efab85a08cfd2f66b406ad739525ff2/a397a4e44d37828f44d93e07999fa70e2bc62e22f46bd9235fae20b5bdc7b34b.json":384,"wiki/concepts/backbone-dit.md":384,"wiki/meta/ledgers/claim-ledger.json":384,"wiki/meta/ledgers/source-ledger.json":384,"wiki/meta/operations/000000000004-mixed-publication.json":384,"wiki/meta/records/assessment-heads.json":384,"wiki/meta/records/papers/sha256-aaaaaaaaaaaaaaaaaaaaaaaaaaaaaaaaaaaaaaaaaaaaaaaaaaaaaaaaaaaaaaaa.json":384,"wiki/meta/records/source-display-heads.json":384,"wiki/meta/records/source-versions/sva-21f13690dbea47cb9cd0c6fd43410abac0d4028e1b4175847851885f2011c109.json":384,"wiki/meta/registries/operation-head.json":384,"wiki/meta/reviews/clm-e6d6331f11e9b78f11ee/ase-9b0d59411070dabf301e.json":384,"wiki/papers/sha256-aaaaaaaaaaaaaaaaaaaaaaaaaaaaaaaaaaaaaaaaaaaaaaaaaaaaaaaaaaaaaaaa.md":384},"operation_id":"mixed-publication","operation_type":"ingest","schema":"claude-obsidian.transaction-plan.v1","valid":true,"vault_identity":{"device":16777233,"inode":12299210,"state":"existing"}},"operation_id":"mixed-publication","operation_type":"ingest","phase":"inspected","read_preconditions":{".raw/captured/115399a3c02c187ca2949462f8dbe5fb531cf78307e2d7df2bbb3342985911e9.pdf":"115399a3c02c187ca2949462f8dbe5fb531cf78307e2d7df2bbb3342985911e9",".raw/captured/3cf31029bd058478d91b8e8942e762a40efab85a08cfd2f66b406ad739525ff2.md":"3cf31029bd058478d91b8e8942e762a40efab85a08cfd2f66b406ad739525ff2",".raw/captured/8bc91b11e3594275e7b2f8dc0c415d24db6083aa9bed9d33a28ca9885df48daf.bin":"8bc91b11e3594275e7b2f8dc0c415d24db6083aa9bed9d33a28ca9885df48daf",".raw/captured/9fafc3988e8388a89b4c2b8d779193b3f00fc0a4f201caddd10e77a9d23854f8.pdf":"9fafc3988e8388a89b4c2b8d779193b3f00fc0a4f201caddd10e77a9d23854f8",".raw/captured/e6fb44cb96d0e247363c7c8614835492840991273f34dea18ad820fa64279f1a.pdf":"e6fb44cb96d0e247363c7c8614835492840991273f34dea18ad820fa64279f1a",".raw/derived/1